{
  "schema": "ardyn.phase-5.49.consumer-display-accessibility-contract-map-result",
  "schemaVersion": "0.1.0",
  "consumerDisplayAccessibilityContractMapKind": "consumer-display-accessibility-contract-map",
  "consumerDisplayAccessibilityContractMapMode": "review-only",
  "reviewedAt": "2026-06-20T00:00:00.000Z",
  "reviewedAtDefaulted": false,
  "classification": "valid_consumer_display_accessibility_contract_map_runtime_still_blocked",
  "consumerDisplayAccessibilityContractMapProduced": true,
  "consumerDisplayAccessibilityContractMap": {
    "schema": "ardyn.phase-5.49.consumer-display-accessibility-contract-map-state",
    "schemaVersion": "0.1.0",
    "stateKind": "consumer-display-accessibility-contract-map-state",
    "stateMode": "review-only",
    "reviewedAt": "2026-06-20T00:00:00.000Z",
    "sourcePhaseContext": {
      "phase548ProductionReadinessCoverageMatrixIdentifiedFrontendGap": true,
      "ardynRole": "harness-framework-contract-layer",
      "locusAndMultiverseAreConsumers": true,
      "consumerUiImplementedByArdyn": false
    },
    "displayContractEntries": [
      {
        "consumerName": "Locus",
        "displaySurfaceId": "locus.status-control-panels",
        "sourceArdynArtifactType": "phase-status-report",
        "allowedDisplayBehavior": "Render phase status, current posture, and blocked runtime state as read-only labels.",
        "forbiddenDisplayBehavior": [
          "start runtime",
          "enable controls",
          "route reviewer",
          "assign reviewer",
          "persist approval",
          "trigger command"
        ],
        "accessibilityRequirementNotes": {
          "readableLabel": "Ardyn status and control readiness",
          "shortDescription": "Shows review-only Ardyn status without controls.",
          "longDescription": "Locus may display Ardyn phase status, blocked runtime state, and readiness summaries as static review metadata only.",
          "severityStatusVocabulary": [
            "review_only",
            "runtime_blocked",
            "needs_future_contract",
            "not_authorized"
          ],
          "keyboardScreenReaderDisplayNotes": "Expose status text and blocked reason as readable static content; do not attach keyboard activation to blocked controls.",
          "colorIndependentStatusIndicatorRequired": true,
          "reducedMotionDefaultStaticDisplayRequired": true,
          "noAutoExecutionNoHiddenActionSemantics": true
        },
        "requiredFutureContractBeforeInteractivity": "A future Locus control-surface contract plus explicit Ardyn command/runtime authorization.",
        "authorizationFlags": {
          "uiInteractivityAuthorized": false,
          "frontendRuntimeAuthorized": false,
          "browserRuntimeAuthorized": false,
          "runtimeAuthorized": false,
          "commandControlAuthorized": false,
          "databaseStorageAuthorized": false,
          "secretsAuthorized": false,
          "connectorGrantAuthorized": false,
          "fabricRuntimeAuthorized": false,
          "webSocketHttpAuthorized": false,
          "mcpTaskRuntimeAuthorized": false,
          "secureDropRuntimeAuthorized": false,
          "serviceDiscoveryScheduleAuthorized": false,
          "reviewerRoutingAuthorized": false,
          "reviewerAssignmentAuthorized": false,
          "evaluatorExecutionAuthorized": false,
          "approvalDecisionAuthorized": false,
          "approvalGrantAuthorized": false,
          "filesystemProcessControlAuthorized": false
        },
        "nonAuthorizingProof": true
      },
      {
        "consumerName": "Locus",
        "displaySurfaceId": "locus.review-artifact-panels",
        "sourceArdynArtifactType": "review-artifact metadata",
        "allowedDisplayBehavior": "Render artifact fields, source phase, and non-authorizing proof flags as static evidence.",
        "forbiddenDisplayBehavior": [
          "approval decision",
          "approval grant",
          "evaluator execution",
          "reviewer assignment",
          "runtime permission",
          "audit runtime write"
        ],
        "accessibilityRequirementNotes": {
          "readableLabel": "Review artifact summary",
          "shortDescription": "Displays review artifacts as non-authorizing evidence.",
          "longDescription": "Locus may show review artifact summaries, classifications, and rejection reasons without treating them as approvals or grants.",
          "severityStatusVocabulary": [
            "accepted_for_review",
            "rejected",
            "malformed",
            "non_authorizing"
          ],
          "keyboardScreenReaderDisplayNotes": "Keep artifact sections navigable by heading and label every rejection reason as text.",
          "colorIndependentStatusIndicatorRequired": true,
          "reducedMotionDefaultStaticDisplayRequired": true,
          "noAutoExecutionNoHiddenActionSemantics": true
        },
        "requiredFutureContractBeforeInteractivity": "A future human review workflow contract with separate approval-decision and grant phases.",
        "authorizationFlags": {
          "uiInteractivityAuthorized": false,
          "frontendRuntimeAuthorized": false,
          "browserRuntimeAuthorized": false,
          "runtimeAuthorized": false,
          "commandControlAuthorized": false,
          "databaseStorageAuthorized": false,
          "secretsAuthorized": false,
          "connectorGrantAuthorized": false,
          "fabricRuntimeAuthorized": false,
          "webSocketHttpAuthorized": false,
          "mcpTaskRuntimeAuthorized": false,
          "secureDropRuntimeAuthorized": false,
          "serviceDiscoveryScheduleAuthorized": false,
          "reviewerRoutingAuthorized": false,
          "reviewerAssignmentAuthorized": false,
          "evaluatorExecutionAuthorized": false,
          "approvalDecisionAuthorized": false,
          "approvalGrantAuthorized": false,
          "filesystemProcessControlAuthorized": false
        },
        "nonAuthorizingProof": true
      },
      {
        "consumerName": "Locus",
        "displaySurfaceId": "locus.capability-metadata-panels",
        "sourceArdynArtifactType": "capability metadata",
        "allowedDisplayBehavior": "Render capability metadata, requested scopes, and blocked execution status.",
        "forbiddenDisplayBehavior": [
          "adapter runtime call",
          "connector grant",
          "MCP execution",
          "task execution",
          "secret ingestion",
          "network fetch"
        ],
        "accessibilityRequirementNotes": {
          "readableLabel": "Capability metadata",
          "shortDescription": "Shows capability descriptions without invoking tools.",
          "longDescription": "Locus may display Ardyn capability names, tags, scopes, and blocked authorization state without adapter calls or tool execution.",
          "severityStatusVocabulary": [
            "available_as_metadata",
            "blocked",
            "approval_required",
            "not_executable"
          ],
          "keyboardScreenReaderDisplayNotes": "Expose capability name, status, and blocked reason in the same focus region.",
          "colorIndependentStatusIndicatorRequired": true,
          "reducedMotionDefaultStaticDisplayRequired": true,
          "noAutoExecutionNoHiddenActionSemantics": true
        },
        "requiredFutureContractBeforeInteractivity": "A future capability invocation contract with explicit adapter, connector, MCP/task, and secret boundaries.",
        "authorizationFlags": {
          "uiInteractivityAuthorized": false,
          "frontendRuntimeAuthorized": false,
          "browserRuntimeAuthorized": false,
          "runtimeAuthorized": false,
          "commandControlAuthorized": false,
          "databaseStorageAuthorized": false,
          "secretsAuthorized": false,
          "connectorGrantAuthorized": false,
          "fabricRuntimeAuthorized": false,
          "webSocketHttpAuthorized": false,
          "mcpTaskRuntimeAuthorized": false,
          "secureDropRuntimeAuthorized": false,
          "serviceDiscoveryScheduleAuthorized": false,
          "reviewerRoutingAuthorized": false,
          "reviewerAssignmentAuthorized": false,
          "evaluatorExecutionAuthorized": false,
          "approvalDecisionAuthorized": false,
          "approvalGrantAuthorized": false,
          "filesystemProcessControlAuthorized": false
        },
        "nonAuthorizingProof": true
      },
      {
        "consumerName": "Locus",
        "displaySurfaceId": "locus.blocked-command-runtime-indicators",
        "sourceArdynArtifactType": "blocked runtime command metadata",
        "allowedDisplayBehavior": "Render blocked command state and static error semantics.",
        "forbiddenDisplayBehavior": [
          "command exposure",
          "runtime start",
          "dry-run bypass",
          "process spawn",
          "stdin loop",
          "stdout runtime writer"
        ],
        "accessibilityRequirementNotes": {
          "readableLabel": "Runtime unavailable",
          "shortDescription": "Shows blocked command/runtime status.",
          "longDescription": "Locus may display that runtime and command exposure are unavailable, including zero-stdout failure expectations.",
          "severityStatusVocabulary": [
            "runtime_unavailable",
            "command_blocked",
            "dry_run_blocked",
            "not_authorized"
          ],
          "keyboardScreenReaderDisplayNotes": "Announce unavailable status and reason without presenting the indicator as a button.",
          "colorIndependentStatusIndicatorRequired": true,
          "reducedMotionDefaultStaticDisplayRequired": true,
          "noAutoExecutionNoHiddenActionSemantics": true
        },
        "requiredFutureContractBeforeInteractivity": "A future command-exposure approval and runtime-enable contract.",
        "authorizationFlags": {